{
  "invocation_id": "inv-metadata-21-example",
  "role": "critic_stats",
  "role_class": "critic",
  "round": 1,
  "attempt": 1,
  "attempt_kind": "role_inference",
  "status": "completed",
  "provider": "openai",
  "provider_call": true,
  "provider_request_status": "accepted",
  "inference_start_status": "started",
  "source_invocation_id": null,
  "cache_usage": "none",
  "session_id": "session-example-21",
  "requested_model": "gpt-5.6-terra",
  "observed_model": null,
  "served_model": null,
  "identity_assurance": "requested_only",
  "model_identity_evidence": {
    "source": "adapter",
    "raw_ids": [],
    "artifact": null,
    "artifact_sha256": null
  },
  "model_family": "gpt",
  "model_source": "declared",
  "reasoning_effort": "high",
  "started_at": "2026-08-30T12:00:00Z",
  "ended_at": "2026-08-30T12:01:00Z",
  "elapsed_seconds": 60,
  "provider_duration_seconds": 58.5,
  "turn_count": 1,
  "provider_cost": {
    "amount": null,
    "currency": null,
    "source": "unavailable",
    "unavailable_reason": "CLI adapter did not expose per-call cost"
  },
  "input_artifact_sha256": "dddddddddddddddddddddddddddddddddddddddddddddddddddddddddddddddd",
  "prompt_sha256": "eeeeeeeeeeeeeeeeeeeeeeeeeeeeeeeeeeeeeeeeeeeeeeeeeeeeeeeeeeeeeeee",
  "output_artifact": "critique/round_1/critic_stats.json",
  "output_sha256": "ffffffffffffffffffffffffffffffffffffffffffffffffffffffffffffffff",
  "usage": {
    "obtainable": true,
    "input_tokens": 100,
    "output_tokens": 20,
    "cached_input_tokens": 50,
    "cache_creation_input_tokens": 0,
    "reasoning_tokens": 10,
    "total_tokens": 120,
    "source": "api_response",
    "unavailable_reasons": {},
    "total_tokens_kind": "provider_reported",
    "total_tokens_components": [],
    "total_tokens_unavailable_reason": null,
    "semantics": {
      "input_tokens": "includes_cache_read",
      "cache_read_tokens": "subset_of_input",
      "cache_write_tokens": "subset_of_input",
      "reasoning_tokens": "subset_of_output",
      "normalized_total": "provider_reported"
    }
  },
  "usage_by_model": [],
  "unattributed_usage": {
    "obtainable": true,
    "input_tokens": 100,
    "output_tokens": 20,
    "cached_input_tokens": 50,
    "cache_creation_input_tokens": 0,
    "reasoning_tokens": 10,
    "total_tokens": 120,
    "source": "api_response",
    "unavailable_reasons": {},
    "total_tokens_kind": "provider_reported",
    "total_tokens_components": [],
    "total_tokens_unavailable_reason": null,
    "semantics": {
      "input_tokens": "includes_cache_read",
      "cache_read_tokens": "subset_of_input",
      "cache_write_tokens": "subset_of_input",
      "reasoning_tokens": "subset_of_output",
      "normalized_total": "provider_reported"
    }
  },
  "error": null,
  "error_class": null,
  "legacy_source": null
}
