{
  "invocation_id": "inv-example-1",
  "role": "critic_stats",
  "role_class": "critic",
  "round": 1,
  "attempt": 1,
  "status": "completed",
  "provider": "provider-a",
  "provider_call": true,
  "cache_usage": "write",
  "session_id": "session-example-1",
  "requested_model": "model-alias",
  "observed_model": "provider-model-version",
  "observed_model_ids": [
    "provider-model-version"
  ],
  "model_family": "family-a",
  "model_source": "observed",
  "reasoning_effort": "high",
  "started_at": "2026-08-27T12:00:00Z",
  "ended_at": "2026-08-27T12:01:00Z",
  "elapsed_seconds": 60,
  "input_artifact_sha256": "dddddddddddddddddddddddddddddddddddddddddddddddddddddddddddddddd",
  "prompt_sha256": "eeeeeeeeeeeeeeeeeeeeeeeeeeeeeeeeeeeeeeeeeeeeeeeeeeeeeeeeeeeeeeee",
  "output_artifact": "critique/round_1/critic_stats.json",
  "output_sha256": "ffffffffffffffffffffffffffffffffffffffffffffffffffffffffffffffff",
  "usage": {
    "obtainable": true,
    "input_tokens": 100,
    "output_tokens": 20,
    "cached_input_tokens": 50,
    "reasoning_tokens": 10,
    "total_tokens": 120,
    "source": "api_response"
  },
  "error": null,
  "error_class": null,
  "legacy_source": null
}
